{
  "case_id": "33333333-3333-4333-8333-333333333333",
  "evaluation_id": "44444444-4444-4444-8444-444444444444",
  "evaluation_version": 1,
  "case_version": 2,
  "decision_type_id": "tim-compare-three",
  "family_id": "timing_opt",
  "mode": "compare_dates",
  "precision_level": "L4",
  "engine_id": "decision-engine-v1",
  "created_at": "2026-08-07T11:00:00Z",
  "schema_version": "1.0.0",
  "recommendation": {
    "stance": "prefer_alternate",
    "conditions": [],
    "summary": "Prefer the highest-ranked candidate while preserving operational flexibility."
  },
  "timing": {
    "material": true,
    "band": "high",
    "score": 88,
    "candidates": [
      {
        "date": "2026-09-10",
        "rank": 1,
        "score": 88,
        "band": "high"
      },
      {
        "date": "2026-09-12",
        "rank": 2,
        "score": 74,
        "band": "moderate"
      },
      {
        "date": "2026-09-15",
        "rank": 3,
        "score": 61,
        "band": "moderate"
      }
    ],
    "notes": "The first candidate ranks highest across timing inputs."
  },
  "confidence": {
    "value": 80,
    "precision_level": "L4",
    "penalties": []
  },
  "evidence": {
    "items": [
      {
        "framework_id": "astro_timing",
        "eligibility": "registered",
        "artifact_ref": "evidence://timing/compare-1",
        "limits": ["Scores are comparative, not guarantees."]
      }
    ]
  },
  "drivers": {
    "items": [
      {
        "id": "timing_quality",
        "label": "Timing quality",
        "score": 88,
        "band": "high",
        "support": "The first date has the strongest relative signal.",
        "friction": "External availability may constrain the choice."
      }
    ]
  },
  "tradeoffs": {
    "items": ["Higher timing score — lower scheduling flexibility"]
  },
  "risks": {
    "items": ["Operational constraints may override the preferred date."]
  },
  "opportunities": {
    "items": ["Reserve the preferred date before availability changes."]
  },
  "action_plan": {
    "steps": [
      {
        "order": 1,
        "action": "Confirm availability for the first-ranked date.",
        "condition": null
      },
      {
        "order": 2,
        "action": "Hold the second-ranked date as backup.",
        "condition": "If the first date is unavailable"
      }
    ]
  },
  "counter_recommendation": {
    "stance": "proceed_with_conditions",
    "summary": "Use the second-ranked date when logistics are materially better.",
    "reason": "A moderate timing difference may be outweighed by operational feasibility."
  },
  "explainability": {
    "why": "The first date has the strongest deterministic ranking.",
    "why_not": "The remaining dates have weaker combined timing scores.",
    "assumptions": ["All candidates are operationally feasible."],
    "limits": ["No external stakeholder availability was evaluated."]
  },
  "improve_accuracy": {
    "items": ["Add stakeholder availability constraints."]
  },
  "next_decisions": {
    "items": []
  },
  "related_decisions": {
    "items": [
      {
        "decision_type_id": "tim-meeting",
        "label": "Schedule high-stakes meeting"
      }
    ]
  }
}
